{
  "business_action": "create_search_request",
  "target_service": "PropertySearchService",
  "parameters": {
    "transaction_type": "buy",
    "property_type": "appartement",
    "city": "Bafoussam",
    "budget": 25000000,
    "bedrooms": 3,
    "preferred_areas": [
      "Tamdja",
      "Kena"
    ]
  },
  "expected_result": "Recherche de biens correspondant aux criteres",
  "handover_required": false
}