{
  "business_action": "create_search_request",
  "target_service": "PropertySearchService",
  "parameters": {
    "transaction_type": "rent",
    "property_type": "appartement",
    "city": "Yaoundé",
    "budget": 210000,
    "bedrooms": 2,
    "preferred_areas": [
      "Melen"
    ],
    "move_in_date": "octobre"
  },
  "expected_result": "Recherche de biens correspondant aux criteres",
  "handover_required": false
}