{
  "business_action": "none",
  "target_service": "None",
  "parameters": {
    "transaction_type": "rent",
    "property_type": "apartment",
    "city": "Douala",
    "preferred_areas": [
      "Douala",
      "200"
    ],
    "budget": 200000,
    "bedrooms": 2
  },
  "expected_result": "Aucune action",
  "handover_required": false
}